{
  "timestamp": "2026-06-30T06:40:23.590729+00:00",
  "service": "cerynix-action-broker",
  "action": "run_tool: cerynix-optimizer apply gaming",
  "status": "success",
  "details": {
    "arguments": [
      "gaming"
    ],
    "operator": "cerynix-ai-assistant",
    "approval_level": "suggest_only"
  }
}